{"schema_version":1,"name":"Developer","description":"Curated Windows development workstation","selections":{"powershell":{"package":true,"config":true},"git":{"package":true,"config":true},"micro":{"package":true,"config":true},"gh":{"package":true,"config":true},"yazi":{"package":true,"config":true},"starship":{"package":true,"config":true},"ripgrep":{"package":true,"config":false},"fzf":{"package":true,"config":false},"fd":{"package":true,"config":false},"bat":{"package":true,"config":false},"eza":{"package":true,"config":false},"jq":{"package":true,"config":false},"zoxide":{"package":true,"config":false},"vscode":{"package":true,"config":true},"terminal":{"package":true,"config":true}}}
